marca_unique,total_marca,marca,medias_notas,reveja,marca,variedade,estilo,pais,notas_puras,marcas_noodles
,,,,1519,Ching's Secret,Manchurian Instant Noodles,Pacote,India,3.5,
,,,,1518,Mamee,Chef Gold Recipe Bihun Kari Seribu Rasa,Pacote,Malaysia,4.5,
,,,,1517,Katoz,Instant Noodles Spicy Chili,Pacote,Sweden,3.5,
,,,,1516,Men-Sunaoshi,Miso Ramen,Pacote,Japan,3.75,
,,,,1515,Nongshim,Neoguri Udon Seafood & Mild,Pacote,South Korea,4.0,
,,,,1514,Maggi,Royale Penang Seafood Curry,Pacote,Malaysia,4.5,
,,,,1513,Mama,Instant Noodles Tom Yum Pork Flavour,Pacote,Thailand,4.0,
,,,,1512,Chewy,Japanese Fried Ramen Noodles Kyoto Barbecue Sauce Flavour,Pacote,Hong Kong,1.75,
,,,,1511,Long Jun Hang,Tainan Yi Mien With Sesame Oil Sauce,Pacote,Taiwan,3.25,
,,,,1510,Knorr,Quick Serve Macaroni Wonton Broth,Pacote,Hong Kong,3.25,
,,,,1509,Nissin,Donbei Kitsune Udon Mini,Tigela,Japan,3.5,
,,,,1508,Mamee,Chef Gold Recipe Mi Kari Seribu Rasa,Pacote,Malaysia,5.0,
,,,,1507,Nissin,Chu Qian Yi Ding Prawn Flavour Instant Noodles With Soup Base,Pacote,Singapore,3.5,
,,,,1506,Nissin,Cup Noodles Mug Noodles Spicy Vegetable,Pacote,India,3.75,
,,,,1505,Shan,Shoop Instant Noodles BBQ Flavour,Pacote,Pakistan,3.25,
,,,,1504,Master Kong,Stewed Beef Flavor Cooking Noodle,Pacote,China,4.25,
,,,,1503,Nongshim,Bowl Noodle Soup Shrimp Habanero Lime Flavor,Tigela,USA,3.25,
,,,,1502,JML,Artificial Pork Flavor Noodles,Pacote,China,4.0,
,,,,1501,Acecook,Ohmori Chukafu Yakisoba,Bandeja,Japan,3.25,
,,,,1500,MyKuali,Penang Red Tom Yum Goong Noodle,Pacote,Malaysia,5.0,
,,,,1499,United,Instant Noodles Xi Gon Artificial Stewed Beef Flavor,Pacote,Vietnam,3.25,
,,,,1498,Samyang Foods,Sogokimyun Hot Flavor Noodle Soup,Pacote,South Korea,3.5,
,,,,1497,Nissin,Easy Fideos Picante Lime Shrimp Flavor Ramen Noodle Soup,Copo,USA,3.5,
,,,,1496,Master Kong,Mianba Pork Ribs Flavor Instant Noodles,Pacote,China,4.5,
,,,,1495,Super,Instant Noodles Mee Goreng,Copo,Malaysia,3.75,
,,,,1494,Indomie,Pop Mie Chicken Flavour Cup Noodles,Copo,Indonesia,3.5,
,,,,1493,Maruchan,Magomi-an Kitsune Udon (Eastern Japan Flavor),Tigela,Japan,4.25,
,,,,1492,Wai Wai,Quick Zabb Tom Yum Shrimp Flavour Instant Noodles,Pacote,Thailand,4.0,
,,,,1491,Ottogi,Potato Ramen,Pacote,South Korea,3.75,
,,,,1490,Nissin,Soba Chili Noodles With Japanese Yakisoba Sauce,Copo,Germany,3.5,
,,,,1489,Maggi,Multigrainz Noodles Spice Remix,Pacote,India,3.25,
,,,,1488,Mom's Dry Noodle,Sichuan Spicy Flavor,Pacote,Taiwan,5.0,
,,,,1487,ICA,Asia Snabbnudlar Kycklingsmak,Pacote,Sweden,3.25,
,,,,1486,Mom's Dry Noodle,Onion Oil & Shrimp Flavor,Pacote,Taiwan,5.0,
,,,,1485,Nongshim,Spicy Tonkotsu Noodle Soup,Pacote,USA,5.0,
,,,,1484,Ibumie,Mee Baa..Gus Mi Goreng Spicier Original Flavour,Pacote,Malaysia,3.75,
,,,,1483,Four Seas,Hot & Spicy Instant Noodle (Mushroom & Beef Flavour),Pacote,Hong Kong,4.0,
,,,,1482,Maruchan,I Want To Eat Ramen' Shoyu Flavor,Pacote,Japan,4.0,
,,,,1481,Master Kong,Mushroom Stew Chicken Ramen,Pacote,China,3.5,
,,,,1480,Paldo,Jjol Bibim Men,Pacote,South Korea,4.0,
,,,,1479,Nissin,Cup Noodles Easy Fideos Tomato Chicken Flavor Ramen Noodle Soup,Copo,USA,3.5,
,,,,1478,Ruski,Tom Yam Flavour Instant Noodles,Pacote,Thailand,4.0,
,,,,1477,Mama,Instant Noodles Moo Nam Tok Flavour,Pacote,Thailand,4.0,
,,,,1476,Thai Chef,Instant Nudelsuppe Shrimp Flavour,Pacote,Germany,3.5,
,,,,1475,Bamee,Cup Oriental Style Instant Noodles Chicken Flavour,Copo,Thailand,3.25,
,,,,1474,Mama,Instant Noodle Shrimp Tom Yum Flavour Jumbo Pack,Pacote,Thailand,4.0,
,,,,1473,Mama,Instant Cup Noodles Shrimp Tom Yum Flavour (Extreme),Copo,Thailand,5.0,
,,,,1472,Ruski,Chicken Masala Flavour Instant Fried Noodles,Pacote,Thailand,3.75,
,,,,1471,Mama,Instant Noodles Shrimp Creamy Tom Yum Flavour Jumbo Pack,Pacote,Thailand,5.0,
,,,,1470,Mama,Instant Cup Noodles Spicy Cheese Flavour,Copo,Thailand,3.5,
,,,,1469,Bamee,Oriental Style Instant Noodles Beef Flavour,Pacote,Germany,3.25,
,,,,1468,Mama,Instant Cup Noodles Seafood Pad Kee Mao Flavour,Copo,Thailand,5.0,
,,,,1467,Ruski,Creamy Tom Yam Instant Noodles,Pacote,Thailand,4.5,
,,,,1466,Mama,Oriental Style Instant Noodles Green Curry Flavour Jumbo Pack,Pacote,Thailand,5.0,
,,,,1465,Thai Chef,"Shrimp ""Tom Yum"" Instant Nudelsuppe",Pacote,Germany,3.5,
,,,,1464,Nanyang Chef,Penang White curry Noodle With Nanyang Chilli Paste,Pacote,Malaysia,4.75,
,,,,1463,Maruchan,Instant Lunch California Vegetable Ramen Noodles With Vegetables,Copo,USA,3.5,
,,,,1462,Wei Lih,Steam Instant Noodles Korean Salt & Rib Soup Flavour,Tigela,Taiwan,2.25,
,,,,1461,Nissin,Cup Noodles Black Pepper Crab Flavour,Copo,Singapore,4.0,
,,,,1460,Nissin,Premium Instant Noodles Spicy Beef Flavour,Pacote,Singapore,3.75,
,,,,1459,Nissin,Cup Noodles Tom Yam Veg Flavour,Copo,Singapore,4.0,
,,,,1458,Nissin,Premium Instant Noodles Roasted Beef Flavour,Tigela,Singapore,3.75,
,,,,1457,Nissin,Chu Qian Yi Ding Sesame Oil Flavour,Pacote,Singapore,3.75,
,,,,1456,Nissin,Cup Noodles Chicken Flavour,Copo,Singapore,3.5,
,,,,1455,Nissin,Premium Instant Noodles XO Sauce Seafood Flavour,Pacote,Singapore,3.75,
,,,,1454,Nissin,Cup Noodles Chilli Crab Flavour,Copo,Singapore,4.0,
,,,,1453,Nissin,Japanese Ramen Kyushu Black Instant Noodles With Soup Base,Pacote,Singapore,5.0,
,,,,1452,Nissin,Premium Instant Noodles Spicy Beef Flavour,Tigela,Singapore,3.75,
,,,,1451,Nissin,Cup Noodles Tom Yam Seafood Flavour,Copo,Singapore,4.0,
,,,,1450,Nissin,Japanese Ramen Tokyo Shoyu Instant Noodles With Soup Base,Pacote,Singapore,5.0,
,,,,1449,Nissin,Cup Noodles Seafood Curry Flavour,Copo,Singapore,4.0,
,,,,1448,Nissin,Premium Instant Noodles Roasted Beef Flavour,Pacote,Singapore,4.25,
,,,,1447,Nissin,Cup Noodles Cream Of Chicken Flavour,Copo,Singapore,4.0,
,,,,1446,Myojo,Ippei-Chan Jumbo Night Market Style Yakisoba,Bandeja,Japan,4.5,
,,,,1445,MyKuali,Penang Hokkien Prawn Noodle,Pacote,Malaysia,5.0,
,,,,1444,Maruchan,Instant Lunch Jalapeno Cheddar Flavor Ramen Noodles,Copo,USA,3.5,
,,,,1443,Nongshim,Harmony Korean Spicy Noodle Dish With Chipotle,Pacote,USA,4.25,
,,,,1442,Maggi,2 Minute Noodles Tom Yam Flavour,Pacote,Singapore,3.5,
,,,,1441,Nissin,Souper Meal Chili Picante Chicken With Lime Flavor Ramen Noodle Soup,Tigela,USA,3.5,
,,,,1440,Wu-Mu,Dried Noodle With Beef Flavor Sauce,Pacote,Taiwan,3.0,
,,,,1439,Adabi,Mi Segera Mi Goreng Pedas Instant Noodles,Pacote,Malaysia,3.5,
,,,,1438,Maruchan,Old Style Miso Ramen,Pacote,Japan,3.5,
,,,,1437,Knorr,Quick Serve Macaroni Abalone & Chicken Flavour,Pacote,Hong Kong,3.0,
,,,,1436,Chencun,Rice Noodle Beef With Brown Sauce,Copo,China,3.5,
,,,,1435,Maggi,2 Minute Noodles Assam Laksa Flavour,Pacote,Singapore,4.0,
,,,,1434,Maggi,Hot Cup Perisa Kari,Copo,Malaysia,3.5,
,,,,1433,Maggi,2 Minute Noodles Curry Flavour,Pacote,Singapore,3.75,
,,,,1432,Maggi,Senses Laksa Instant Noodles,Pacote,Singapore,5.0,
,,,,1431,Maggi,Extra Spicy Curry Instant Noodles,Pacote,Singapore,5.0,
,,,,1430,Samyang Foods,Buldak Bokkummyeon,Tigela,South Korea,4.0,
,,,,1429,Nissin,Sabor A Gallina Fideos Con Instantanea,Pacote,Colombia,3.5,
,,,,1428,Myojo,Chukazanmai Beijing Style Salt Ramen,Pacote,Japan,3.0,
,,,,1427,Osaka Ramen,Miso Ramen,Tigela,USA,3.75,
,,,,1426,Ottogi,Cheese Bokki,Tigela,South Korea,4.0,
,,,,1425,Hao Way,Instant Penang White Curry Noodles,Pacote,Malaysia,4.5,
,,,,1424,Sainsbury's,Curry Flavour Instant Noodles,Pacote,UK,1.5,
,,,,1423,Vina Acecook,King Chef Seafood With Kimchi Flavour,Pacote,Vietnam,3.0,
,,,,1422,Nissin,Pan Asian Kitchen Spicy Szechuan Chicken Flavor Ramen Noodles,Bandeja,USA,3.0,
,,,,1421,Nongshim,Korean Clay Pot Ramyun Noodle,Copo,China,2.75,
,,,,1420,Maruchan,I Want To Eat Ramen Shio,Pacote,Japan,3.75,
,,,,1419,Vifon,Ngon-Ngon Tom Yum Minced Pork Noodle,Copo,Vietnam,3.5,
,,,,1418,Ottogi,Ppushu Ppushu Grilled Chicken Flavor,Pacote,South Korea,1.0,
,,,,1417,Sau Tao,Oat Noodle Abalone Flavored,Pacote,Taiwan,1.75,
,,,,1416,Myojo,Chukazanmai Szechuan Style Miso,Pacote,Japan,2.0,
,,,,1415,Chewy,Instant Rice Vermicelli Original Flavour,Pacote,Hong Kong,0.5,
,,,,1414,Paldo,Cheese Ramyun (for US market),Pacote,South Korea,5.0,
,,,,1413,Chering Chang,Curry La-Men,Pacote,Taiwan,5.0,
,,,,1412,Chewy,Non-Fried Ramen Noodles Taiwan Roast Pork Flavour,Pacote,Hong Kong,4.0,
,,,,1411,A-Sha Dry Noodle,Prince Katsu Snack Noodles,Pacote,Taiwan,4.0,
,,,,1410,Adabi,Mi Segera Tom Yam Instant Noodles,Pacote,Malaysia,3.25,
,,,,1409,Baixiang Noodles,Spicy Artificial Beef Flavour Instant Noodles With Soup Base,Pacote,China,3.5,
,,,,1408,Pamana,Chicken Sopas Creamy Macaroni Soup,Copo,Philippines,3.5,
,,,,1407,Annie Chun's,Ramen House Thai Coconut Ramen,Pacote,USA,5.0,
,,,,1406,La Fonte,Spaghetti With Mushroom Sauce,Pacote,Indonesia,3.75,
,,,,1405,Maggi,Masala Dumdaar Noodles,Pacote,India,3.75,
,,,,1404,Thai Choice,Instant Noodles Seafood Flavour,Copo,Thailand,4.0,
,,,,1403,Tesco,Everyday Value Chicken & Mushroom Flavour,Copo,UK,0.5,
,,,,1402,Pop Bihun,Spesial Rasa Kari Ayam Pedas,Pacote,Indonesia,3.75,
,,,,1401,Myojo,Yomise No Yakisoba Shiodare Flavor With Black Pepper Mayonnaise,Bandeja,Japan,3.75,
,,,,1400,Pulmuone,Nature Is Delicious Non-Fried Ramyun (Spicy Flavor) (New Version),Pacote,South Korea,3.75,
,,,,1399,Vina Acecook,Oh! Ricey Pho Bo Instant Rice Noodles,Tigela,Vietnam,3.75,
,,,,1398,Nissin,Fried Noodle Specialist Tom Yam Mee Goreng Flavour,Pacote,Singapore,3.0,
,,,,1397,Wu-Mu,Steam Seafood Flavor Ramen,Pacote,Taiwan,4.0,
,,,,1396,Oyatsu,Baby Star Snack Noodle Yakisoba Flavor,Pacote,Japan,4.75,
,,,,1395,Snapdragon,Singapore Laksa Curry Soup Bowl,Tigela,USA,4.25,
,,,,1394,Paldo,Mild Kokomen (Prototype),Pacote,South Korea,4.5,
,,,,1393,Saji,Sajimee Curry Soup Flavour,Pacote,Malaysia,4.25,
,,,,1392,Miracle Noodle,Miso Marvellous Soup,Pacote,USA,4.0,
,,,,1391,Shan,Shoop Instant Noodles Chicken Flavour,Pacote,Pakistan,3.5,
,,,,1390,Indomie,Mi Goreng Rasa Iga Penyet,Pacote,Indonesia,4.75,
,,,,1389,Tiger Tiger,Traveller's Choice Thai Red Curry Flavour Instant Noodles,Pacote,UK,1.75,
,,,,1388,Paldo,Barbecue Ramyun (Prototype),Pacote,South Korea,3.75,
,,,,1387,Takamori Kosan,Red Pepper 7 Garlic Peperoncino,Pacote,Japan,4.0,
,,,,1386,Takamori Kosan,Sukiyaki Style Noodle Stew,Pacote,Japan,4.5,
,,,,1385,Takamori Kosan,Yaki-Udon Roast Soy Sauce,Pacote,Japan,3.75,
,,,,1384,Takamori Kosan,Hiyashi Udon Bonito Sauce,Pacote,Japan,3.0,
,,,,1383,Takamori Kosan,Futomen Yakisoba,Pacote,Japan,4.75,
,,,,1382,Takamori Kosan,Hiyashi Chuka Lemon Sauce,Pacote,Japan,4.75,
,,,,1381,Takamori Kosan,Curry Udon,Pacote,Japan,5.0,
,,,,1380,Takamori Kosan,Chanpon,Pacote,Japan,3.75,
,,,,1379,Takamori Kosan,Shio Yakisoba,Pacote,Japan,4.0,
,,,,1378,Takamori Kosan,Yakisoba,Pacote,Japan,5.0,
,,,,1377,Takamori Kosan,Yaki-Udon Mild Spicy Sauce,Pacote,Japan,4.25,
,,,,1376,Takamori Kosan,Katsuo Dashi Udon,Pacote,Japan,3.75,
,,,,1375,Takamori Kosan,Spaghetti Napolitan,Pacote,Japan,4.0,
,,,,1374,Tokyo Noodle,Spicy Garlic Ramen,Pacote,Japan,3.25,
,,,,1373,Tesco,Everyday Value Beef & Tomato Flavour Noodles,Copo,UK,2.0,
,,,,1372,Samyang Foods,Nagasaki Jjamppong,Copo,South Korea,3.75,
,,,,1371,Campbell's,Hearty Noodles Thai Flavour,Copo,Canada,0.0,
,,,,1370,Papa,Oriental Style Instant 'Kua-Chap',Pacote,Thailand,3.25,
,,,,1369,A-Sha Dry Noodle,Hello Kitty Za Jiang (Soybean Sauce),Pacote,Taiwan,3.25,
,,,,1368,Nissin,Soba Teriyaki Noodles With Japanese Yakisoba Sauce,Copo,Germany,3.0,
,,,,1367,Sawadee,Instant Noodles Vegetable & Mushroom Flavour,Pacote,UK,1.5,
,,,,1366,Nongshim,Sir Long Tang Creamy Beef Noodle Soup,Copo,USA,4.25,
,,,,1365,Four Seas,Seaweed Hot & Spicy Instant Noodle Mushroom & Beef Flavour,Tigela,Hong Kong,3.5,
,,,,1364,Golden Wheat,Korean Style Stew Pork Flavour Noodle Soup,Tigela,China,1.75,
,,,,1363,Sau Tao,Instant Noodle King Won Ton Flavor,Pacote,Hong Kong,2.75,
,,,,1362,Mamee,Instant Noodles Curry Flavour,Pacote,Malaysia,3.5,
,,,,1361,Mamee,Chef Creamy Tom Yam Flavour,Pacote,Malaysia,5.0,
,,,,1360,Mamee,Monster BBQ Flavour Snack Noodles,Pacote,Malaysia,3.75,
,,,,1359,Mamee,Chef Curry Laksa Flavour,Copo,Malaysia,5.0,
,,,,1358,Mamee,SLLRRRP! Asam Laksa,Pacote,Malaysia,4.0,
,,,,1357,Mamee,Mie Goreng Indonesia Spicy Sambal,Copo,Malaysia,5.0,
,,,,1356,Mamee,Chef Spicy Chicken Shiitake Flavour,Pacote,Malaysia,3.25,
,,,,1355,Mamee,Instant Vermicelli Chicken Flavour,Pacote,Malaysia,3.25,
,,,,1354,Mamee,Chef Creamy Tom Yam Flavour,Copo,Malaysia,4.75,
,,,,1353,Mamee,Instant Noodles Vegetarian Flavour,Pacote,Malaysia,3.75,
,,,,1352,Mamee,SLLRRRP! Kari Berapi,Pacote,Malaysia,3.75,
,,,,1351,Mamee,Monster Chicken Flavour Snack Noodles,Pacote,Malaysia,4.0,
,,,,1350,Mamee,Chef Curry Laksa Flavour,Pacote,Malaysia,5.0,
,,,,1349,Mamee,Mie Goreng Indonesia Original Flavour,Copo,Malaysia,4.5,
,,,,1348,Mamee,Instant Vermicelli Tom Yam Flavour,Pacote,Malaysia,3.75,
,,,,1347,Paldo,Bulnak Bokkummyun Spicy Fried Octopus Ramyun,Pacote,South Korea,4.0,
,,,,1346,Oyatsu,Baby Star Ramen Round Consomme Mini,Pacote,Japan,3.75,
,,,,1345,Lotus Foods,Forbidden Rice Ramen,Pacote,USA,2.25,
,,,,1344,Lotus Foods,Millet & Brown Rice Ramen,Pacote,USA,4.0,
,,,,1343,Lotus Foods,Jade Pearl Rice Ramen,Pacote,USA,3.25,
,,,,1342,Ah Lai,White Curry Noodle,Pacote,Malaysia,4.5,
,,,,1341,Plats Du Chef,Cuisine Adventures Chicken Pho Soup,Tigela,Canada,5.0,
,,,,1340,Indomie,Taste Of Asia Mi Goreng Rasa Bulgogi Ala Korea,Pacote,Indonesia,2.75,
,,,,1339,Kin-Dee,Instant Rice Noodle Pad Thai,Bandeja,Thailand,3.75,
,,,,1338,Batchelors,Super Noodles Peppered Steak Flavour,Pacote,UK,1.5,
,,,,1337,Sakura Noodle,Chikara Brand Udon Beef Flavor,Pacote,USA,4.25,
,,,,1336,Shirakiku,Fresh Chow Mein Noodles With Seasoning,Pacote,USA,3.75,
,,,,1335,Sakura Noodle,Chikara Brand Udon Hot & Spicy Flavor,Pacote,USA,4.0,
,,,,1334,Sakura Noodle,Chikara Brand Udon Mushroom Flavor,Pacote,USA,3.75,
,,,,1333,Sakura Noodle,Chikara Brand Udon Oriental Flavor,Pacote,USA,3.75,
,,,,1332,Sakura Noodle,Chikara Brand Udon Chicken Flavor,Pacote,USA,3.75,
,,,,1331,Indomie,Taste Of Asia Mi Kuah Rasa Tom Yum Ala Thailand,Pacote,Indonesia,3.75,
,,,,1330,Sapporo Ichiban,Otafuku Okonomi Sauce Yakisoba,Bandeja,Japan,5.0,
,,,,1329,Vifon,Oriental Style Instant Noodle Mi Ga Chicken Flavor,Copo,Vietnam,1.25,
,,,,1328,A-Sha Dry Noodle,Hello Kitty La Wei (Spicy Flavor),Pacote,Taiwan,3.75,
,,,,1327,Unif,Unif-100 Instant Noodles Artificial Tart Beef Flavor,Pacote,China,3.0,
,,,,1326,Mamee,Mi Segera SLLRRRP! Perencah Kari Xtra Pedas,Pacote,Malaysia,3.75,
,,,,1325,Koka,Spicy Shrimp Tom Yam Flavour,Copo,Singapore,3.25,
,,,,1324,Ruski,Instant Noodles Stewed Beef Flavour,Pacote,Thailand,3.5,
,,,,1323,Golden Wheat,Korean Style Mushroom Chicken Flavour Cooking Noodle,Pacote,China,2.0,
,,,,1322,Hi-Myon,Instant Noodle Udon Hot & Spicy,Pacote,South Korea,4.0,
,,,,1321,Takamori Kosan,Fresh Chow Mein Noodles With Seasoning,Pacote,Japan,3.75,
,,,,1320,Mama,Instant Noodles Cup Seafood Flavour,Copo,Thailand,3.75,
,,,,1319,Adabi,Mi Segera Kari Ayam Instant Noodles,Pacote,Malaysia,4.25,
,,,,1318,Nissin,Spa Oh Tarako Spaghetti,Tigela,Japan,4.0,
,,,,1317,Ve Wong,Little Prince Brand Snack Noodles Original Flavor,Pacote,Taiwan,2.5,
,,,,1316,Ottogi,Japchae Vermicelli Noodle,Pacote,South Korea,2.75,
,,,,1315,Sainsbury's,Chicken Flavour Instant Noodles,Pacote,UK,2.75,
,,,,1314,Paldo,Korean Traditional Beef Gomtangmen,Pacote,South Korea,5.0,
,,,,1313,Healtimie,Green Barley Noodle Vegetable Soup,Pacote,Indonesia,3.25,
,,,,1312,Maruchan,I Want To Eat Ramen Miso Flavor,Pacote,Japan,3.75,
,,,,1311,Pop Bihun,Spesial Rasa Soto Ayam,Pacote,Indonesia,4.0,
,,,,1310,Thai Kitchen,Rice Noodle Cart Thai Peanut,Bandeja,USA,3.0,
,,,,1309,Yum Yum,Oriental Style Instant Noodles Seafood Flavour,Copo,Thailand,3.75,
,,,,1308,Nongshim,Soon Veggie Noodle Soup,Pacote,South Korea,5.0,
,,,,1307,Nissin,Cup Noodle Cheese Curry,Copo,Japan,3.75,
,,,,1306,Koka,Oriental Style Instant Noodles Tom Yam Flavour,Pacote,Singapore,2.5,
,,,,1305,A-Sha Dry Noodle,Instant Noodle Original Flavor,Pacote,Taiwan,3.75,
,,,,1304,Nissin,Demae Ramen Shoyu Tonkotsu Artificial Pork Flavour,Pacote,Hong Kong,4.75,
,,,,1303,Western Family,Instant Noodles In A Cup Chicken Flavour,Copo,Canada,1.5,
,,,,1302,Mama,Instant Noodles Yentafo Tom Yum Mohfai Flavour,Pacote,Thailand,5.0,
,,,,1301,Knorr,Quick Serve Macaroni Shrimp Broth,Pacote,Hong Kong,3.25,
,,,,1300,Samyang Foods,Red Nagasaki Jjampong,Pacote,South Korea,5.0,
,,,,1299,Mr. Noodles,Noodles In A Cup Spicy Chicken Simulated Flavour,Copo,Canada,1.0,
,,,,1298,Good Tto Leu Foods,Lightning Beef Bone Tteokguk Rice Cake Soup,Tigela,South Korea,4.0,
,,,,1297,GaGa,Mie Gepeng Kuah Rasa Ayam Lada Hitam,Pacote,Indonesia,3.25,
,,,,1296,Wu-Mu,Ramen With Pickled Mustard Flavor,Pacote,Taiwan,3.5,
,,,,1295,Wu-Mu,Steam Mushroom Flavor Ramen,Pacote,Taiwan,3.25,
,,,,1294,Thai Choice,Instant Noodles Chicken Flavour,Copo,Thailand,3.0,
,,,,1293,Myojo,Prawn Noodles,Pacote,Singapore,4.25,
,,,,1292,Nissin,Cup Noodles Sabor A Carne Sopa Con Fideos,Copo,Colombia,3.0,
,,,,1291,A-One,Mì Ly Instant Noodles Mì Tôm Shrimp Flavor,Copo,Vietnam,3.25,
,,,,1290,Nongshim,Sain Sain Garlic Teriyaki Fresh Cooked Udon Pasta,Bandeja,South Korea,4.5,
,,,,1289,JML,Braised Beef Noodles,Pacote,China,4.0,
,,,,1288,Sau Tao,QQ Scallop Seafood Vermicelli,Tigela,Hong Kong,3.75,
,,,,1287,Kimura,Kumamoto Tonkotsu Ramen,Pacote,Japan,5.0,
,,,,1286,Batchelors,Super Noodles Roast Beef & Onion Flavour,Pacote,UK,3.25,
,,,,1285,Lucky Me!,Supreme Chow Mein Seafood Flavor Instant Stir-Fried Noodles,Tigela,Philippines,3.25,
,,,,1284,Thai Kitchen,Rice Noodle Cart Sweet Citrus Ginger,Bandeja,USA,4.25,
,,,,1283,Nongshim,Oolongmen Kimchi Cup Noodle Soup Mix,Copo,South Korea,4.0,
,,,,1282,Koka,Purple Wheat Noodles Aglio Olio,Pacote,Singapore,2.75,
,,,,1281,Tokachimen Koubou,Jet Black Sesame Oil Pork Tonkotsu,Tigela,Japan,2.25,
,,,,1280,Deshome,Sun Dried Noodle Chlorella Powder Noodle With Curry Sauce,Pacote,Taiwan,5.0,
,,,,1279,Ko-Lee,Instant Noodles Mixed Vegetable,Pacote,UK,3.5,
,,,,1278,Ottogi,Ppushu Ppushu Noodle Snack Bulgogi Flavor,Pacote,South Korea,3.25,
,,,,1277,Vifon,Mì Gà Tìm Chua Cay Hot & Sour Chicken Flavor Instant Noodles,Pacote,Vietnam,2.0,
,,,,1276,Adabi,Mi Bandung Prawn Mee,Pacote,Malaysia,4.25,
,,,,1275,Wu-Mu,Ramen With Stewed Pork Flavor,Pacote,Taiwan,4.5,
,,,,1274,Wu-Mu,Shiitake Flavor Spinach Ramen,Pacote,Taiwan,3.75,
,,,,1273,Sainsbury's,Basics Instant Noodles Chicken Curry Flavour,Pacote,UK,3.25,
,,,,1272,Samyang Foods,Baked Noodle Spicy Grilled Beef Ramyun,Pacote,South Korea,3.5,
,,,,1271,Prima Taste,Singapore Chilli Crab La Mian,Pacote,Singapore,5.0,
,,,,1270,Ko-Lee,Instant Noodles Taste Sensations Creamy Shrimp Tom Yum Flavour,Pacote,UK,5.0,
,,,,1269,Chewy,Rice Vermicelli Scallop With XO Sauce Flavour,Pacote,Hong Kong,2.5,
,,,,1268,Wu-Mu,Dried Noodle With Jah Jan Sauce,Pacote,Taiwan,3.25,
,,,,1267,ABC,Mi Cup Rasa Soto Ayam Chicken Soto Flavour,Copo,Indonesia,3.75,
,,,,1266,ABC,Selera Pedas Mi Goreng Cup Rasa Gulai Ayam Pedas Hot Gulai Chicken,Copo,Indonesia,4.0,
,,,,1265,ABC,Rasa Ayam Bawang Chicken Onion Flavour,Copo,Indonesia,3.75,
,,,,1264,ABC,Selera Pedas Mi Goreng Cup Rasa Ayam Pedas Limau Hot Chicken Lemon Flavour,Copo,Indonesia,4.25,
,,,,1263,Nissin,Cup Noodle Curry X Gunpla RX-78-2 Gundam,Copo,Japan,4.25,
,,,,1262,ABC,Mi Cup Rasa Kari Ayam Chicken Curry Flavour,Copo,Indonesia,3.75,
,,,,1261,Eat & Go,Rasa Baso Sapi Meat Ball Mi Instan Cup,Copo,Indonesia,3.75,
,,,,1260,ABC,Mi Goreng Pangsit Fried Noodle With Dumpling,Pacote,Indonesia,5.0,
,,,,1259,Eat & Go,Chicken Onion Mi Instan Cup,Copo,Indonesia,3.75,
,,,,1258,President,Mi Goreng Rasa Ayam Chicken Flavoured Fried Noodle,Pacote,Indonesia,4.5,
,,,,1257,ABC,Mi Goreng Spesial Special Fried Noodle,Copo,Indonesia,4.0,
,,,,1256,Eat & Go,Curry Chicken Mi Instan Cup,Copo,Indonesia,4.25,
,,,,1255,Thai Choice,Instant Noodles Shrimp Flavour,Copo,Thailand,3.25,
,,,,1254,Four Seas,Sesame Oil Chicken Flavour Instant Noodle,Tigela,Hong Kong,2.75,
,,,,1253,Nissin,Chow Mein Teriyaki Chicken Flavor Chow Mein Noodles,Bandeja,USA,3.75,
,,,,1252,Tesco,Instant Noodles Chow Mein Flavour,Pacote,UK,2.25,
,,,,1251,Mama,Instant Noodles Tom Saab Flavour,Pacote,Thailand,3.5,
,,,,1250,Samyang Foods,三養라면 (Samyang Ramyun) (South Korean Version),Tigela,South Korea,3.75,
,,,,1249,Nissin,Sabor A Pollo Sopa Con Fideos,Copo,Colombia,2.75,
,,,,1248,Wu-Mu,Beef Flavour Tomato Ramen,Pacote,Taiwan,4.0,
,,,,1247,Maruchan,I Want To Eat Ramen Pork Tonkotsu Flavor,Pacote,Japan,4.0,
,,,,1246,Annie Chun's,Ramen House Chicken Vegetable Flavored Ramen,Pacote,USA,4.0,
,,,,1245,Sau Tao,Instant Noodle King Abalone & Chicken Flavoured,Pacote,Hong Kong,3.5,
,,,,1244,Unif,Unif-100 Pickled Cayenne Flavor Beef Ramen,Pacote,China,3.75,
,,,,1243,Nissin,Demae Rice Vermicelli Chicken Flavour Instant Rice Vermicelli With Soup Base,Pacote,Hong Kong,1.75,
,,,,1242,Thai Pavilion,Garlic Chili Instant Rice Noodles & Sauce,Bandeja,USA,4.0,
,,,,1241,Nissin,Donbei Kansai Soy Sauce Flavor Udon,Pacote,Japan,3.75,
,,,,1240,Maggi,Big Kari Perencah (Big Curry Flavor) 2 Minute Noodles,Pacote,Malaysia,4.0,
,,,,1239,SuperMi,Rasa Ayam Spesial,Pacote,Indonesia,4.0,
,,,,1238,Sapporo Ichiban,Sesame Ramen,Pacote,Japan,5.0,
,,,,1237,Mama,Instant Noodles Creamy Tom Yum Minced Pork Flavour,Pacote,Thailand,3.5,
,,,,1236,Emart,Dare You Habanero Ramyun,Copo,South Korea,3.25,
,,,,1235,Nissin,Demae Ramen Miso Tonkotsu Artificial Pork Flavor Ramen Noodle,Pacote,Hong Kong,3.75,
,,,,1234,Sainsbury's,Barbecue Beef Flavour Instant Noodles,Pacote,UK,2.75,
,,,,1233,Nissin,Sabor A Pollo Sopa Instantánea Con Fideos,Pacote,Colombia,3.25,
,,,,1232,GaGa,Mie Gepeng Kuah Rasa Ayam Bawang Pedas,Pacote,Indonesia,3.25,
,,,,1231,A-Sha Dry Noodle,Instant Noodle Shallot Flavor,Pacote,Taiwan,3.75,
,,,,1230,Saji,Sajimee Original Soto Soup Flavor,Pacote,Malaysia,4.0,
,,,,1229,Kumamoto,Tonkotsu Ramen MEGA Dragon,Pacote,Japan,2.5,
,,,,1228,Maruchan,Seimen Japanese Instant Ramen Noodles Shio Aji,Pacote,Japan,3.75,
,,,,1227,Mr. Noodles,Chicken Kimchi Oriental Style Noodles With Soup Base,Tigela,Canada,0.5,
,,,,1226,Master Kong,Artificial Braised Beef Flavor Instant Noodle,Tigela,China,3.75,
,,,,1225,Nissin,Pan Asian Kitchen Sweet & Sour Chicken Flavor Ramen Noodles,Bandeja,USA,3.75,
,,,,1224,HoMyeonDang,Premium Noodle House Seafood Ramyun,Pacote,South Korea,4.0,
,,,,1223,Sawadee,Instant Noodles Prawn Oriental Flavour,Pacote,Malaysia,2.5,
,,,,1222,Nissin,Soba Classic Noodles With Japanese Yakisoba Sauce,Copo,Germany,3.75,
,,,,1221,ABC,Selera Pedas Hot Semur Chicken Flavour,Pacote,Indonesia,4.5,
,,,,1220,Nissin,Ultraman Instant Noodle Pork Flavour,Copo,Japan,3.0,
,,,,1219,Tokyo Noodle,Mini Instant Noodle Spicy Flavor,Pacote,Japan,3.5,
,,,,1218,Sau Tao,Ho Fan Beef Soup Flavored,Pacote,China,3.75,
,,,,1217,Doll,Hello Kitty Dim Sum Noodle Japanese Curry Flavour,Copo,Hong Kong,3.5,
,,,,1216,Batchelors,Super Low Fat Noodles Chilli Chicken Flavour,Pacote,UK,1.0,
,,,,1215,GaGa,Mi Instan Cup Milk Chicken Soup,Copo,Indonesia,4.75,
,,,,1214,Eat & Go,Rendang Beef Flavour Fried Instant Noodle,Copo,Indonesia,5.0,
,,,,1213,Nan Jie Cun,Hot -Dry Instant Noodles Chilli Flavour,Bandeja,China,0.5,
,,,,1212,Ruski,Instant Noodles Tom Yum Flavour,Pacote,Thailand,3.5,
,,,,1211,Nissin,Demae Iccho Instant Noodle With Soup Base Artificial Chicken Flavour,Tigela,Hong Kong,3.0,
,,,,1210,A-Sha Dry Noodle,Hell Spicy Mala,Pacote,Taiwan,4.0,
,,,,1209,Batchelors,Super Noodles Chicken Mushroom Flavour,Pacote,UK,3.25,
,,,,1208,Golden Wheat,Korean Style Stew Prok Flavour Cooking Noodle,Pacote,China,3.5,
,,,,1207,Nissin,UFO Yakisoba With Wasabi Mayonnaise,Tigela,Japan,5.0,
,,,,1206,China Best,Frozen Satay Sauce Noodle,Pacote,Taiwan,1.0,
,,,,1205,Mama,Instant Noodles Pork Flavour With Black Pepper,Pacote,Thailand,3.5,
,,,,1204,Nissin,Cup Noodles Sabor A Gallina,Copo,Colombia,3.5,
,,,,1203,GaGa,Mie Gepeng Kuah Rasa Soto Cabe Hijau,Pacote,Indonesia,3.5,
,,,,1202,Sugakiya Foods,Udon Miso Stew,Pacote,Japan,3.25,
,,,,1201,A-Sha Dry Noodle,Instant Noodle Curry Flavour,Pacote,Taiwan,4.25,
,,,,1200,Men-Sunaoshi,Tonkotsu Ramen,Pacote,Japan,3.75,
,,,,1199,Mama,Instant Noodles Chicken Green Curry Flavour,Pacote,Thailand,3.75,
,,,,1198,Samyang Foods,Maesaengyitangmyun Baked Noodle,Pacote,South Korea,5.0,
,,,,1197,Nissin,Cup Noodle Chilli Tomato,Copo,Japan,4.5,
,,,,1196,Nissin,Bowl Noodles Chicken Flavor,Tigela,USA,3.5,
,,,,1195,Sawadee,Instant Noodles Spicy Tomato Flavour,Pacote,Malaysia,2.5,
,,,,1194,Paldo,Namja Ramyun (US Version),Tigela,South Korea,4.0,
,,,,1193,Nissin,Soba Curry Noodles With Japanese Yakisoba Sauce,Copo,Germany,3.75,
,,,,1192,Wu-Mu,Ramen With Simmered Pork Flavor,Pacote,Taiwan,3.75,
,,,,1191,GaGa,Seribu 1000 Goreng Spesial,Pacote,Indonesia,4.0,
,,,,1190,Sanrio,Hello Kitty Hakata Shoyutonkotsu Ramen,Tigela,Japan,3.75,
,,,,1189,Acecook,Comet Mori Yukino Tan-tan men,Tigela,Japan,5.0,
,,,,1188,Chencun,Braised Pork Ribs,Copo,China,3.0,
,,,,1187,Nongshim,Shin Ramyun Cup,Copo,South Korea,3.5,
,,,,1186,Nissin,Sabor A Carne Sopa Instantánea Con Fideos,Pacote,Colombia,3.75,
,,,,1185,Sainsbury's,Basics Instant Noodles Chicken Flavour,Pacote,UK,3.25,
,,,,1184,Sapporo Ichiban,Pokemon Shoyu Ramen,Copo,Japan,3.5,
,,,,1183,Paldo,Cheese Noodle,Pacote,South Korea,5.0,
,,,,1182,Ko-Lee,Go Noodles Xtreme Hot & Spicy Flavour,Pacote,UK,3.75,
,,,,1181,Samyang Foods,Star Popeye Ramyun Snack,Pacote,South Korea,4.0,
,,,,1180,Wei Lih,What’s That? Leisure Meatballs Spicy Chicken Flavor,Pacote,Taiwan,3.75,
,,,,1179,Myojo,Chukazanmai Guangdong Style Ramen,Pacote,Japan,4.25,
,,,,1178,Nongshim,Shin Black Spicy Pot-au-feu Flavor Premium Noodle Soup,Copo,USA,5.0,
,,,,1177,ABC,Mi ABC Rasa Ayam Bawang (Onion Chicken),Pacote,Indonesia,4.0,
,,,,1176,Maruchan,Old Style Shio Ramen,Pacote,Japan,3.5,
,,,,1175,Healtimie,Green Barley Noodle Milk Chicken Soup,Pacote,Indonesia,4.25,
,,,,1174,Itomen,Crab Flavor Instant Ramen,Pacote,Japan,4.0,
,,,,1173,Pop Bihun,Spesial Goreng Special,Pacote,Indonesia,3.5,
,,,,1172,Koyo,Seaweed Ramen Made With Organic Noodles,Pacote,USA,2.75,
,,,,1171,Tiger Tiger,Traveller's Choice Indian Tikka Masala Flavour,Pacote,UK,3.0,
